{
    "schema": "ark.scenario.v1",
    "scenario_id": "pal-human-guided-approval",
    "version": 1,
    "module": "project-audit-ledger",
    "title": "Human-guided approval and route clarity",
    "purpose": "Validate whether unavailable process routes are defects, permission boundaries, or obsolete navigation contracts.",
    "fronts": [
        "design",
        "logic",
        "semantics"
    ],
    "directions": [
        {
            "direction_id": "direction-1",
            "front": "logic",
            "statement": "The approval queue route is available to the administrator",
            "check": "route_available",
            "route": "/admin/project-audit-ledger/approvals",
            "selector": null,
            "expected": null
        },
        {
            "direction_id": "direction-2",
            "front": "semantics",
            "statement": "The issuance route communicates its availability and purpose clearly",
            "check": "route_available",
            "route": "/admin/project-audit-ledger/issuances",
            "selector": null,
            "expected": null
        }
    ],
    "questions": [
        "Can an administrator understand why an approval or issuance route is unavailable?",
        "Does the interface distinguish an unavailable feature from a permission restriction?"
    ],
    "data": {
        "entities": [],
        "relationships": []
    },
    "cleanup": {
        "required": true,
        "preserve_evidence": true
    },
    "created_at": "2026-07-16T09:49:49+00:00",
    "created_by": "human-tester"
}